{
  "schema_version": 1,
  "receipt_id": "2026-09-23-incoming-navigation-notifications",
  "project_id": "teambrain",
  "actor_id": "codex",
  "created_at": "2026-09-23T13:51:11+03:00",
  "summary": "Added per-team and per-project unread navigation lights for incoming member, chat, decision, activity, calendar, and task updates. Current-user aliases are excluded, opening a view clears its unread state, and polling detects synchronized changes. Collaboration state now uses Git-trackable collaboration paths while legacy hidden files remain readable; canonical event files received through Git are reconciled into the local index.",
  "sources": [
    "public/notifications.js",
    "public/app.js",
    "public/notifications.css",
    "src/workspace.js",
    "src/chat-store.js",
    "src/team-members.js",
    "src/planner.js",
    "test/notifications.test.js",
    "test/workspace.test.js"
  ],
  "privacy_review": true,
  "status": "pending",
  "related_decisions": [],
  "related_commits": [],
  "follow_ups": [
    "Human-review the pending receipt before promoting it to canonical shared knowledge."
  ]
}
