{
  "schema_version": 1,
  "receipt_id": "2026-10-05-calendar-scroll-fix",
  "project_id": "teambrain",
  "actor_id": "codex",
  "created_at": "2026-10-05T23:59:45+03:00",
  "summary": "Restored vertical scrolling on the dashboard calendar view while preserving horizontal overflow protection and the viewport-fitted calendar layout.",
  "sources": [
    "public/notifications.css",
    "test/workspace.test.js"
  ],
  "privacy_review": true,
  "status": "pending",
  "related_decisions": [],
  "related_commits": [],
  "follow_ups": [
    "Human-review the pending receipt before promoting it to canonical shared knowledge."
  ]
}
