{
  "schema_version": 1,
  "receipt_id": "2026-10-05-agent-setup-prompt-fallback",
  "project_id": "teambrain",
  "actor_id": "codex",
  "created_at": "2026-10-05T23:59:30+03:00",
  "summary": "Fixed the dashboard setup guide so the copyable AI-agent installation message remains populated when an older running dashboard API omits agent_prompt. The client now builds a safe fallback from the exact memory repository, team, project, and setup command while preferring newer server-provided prompts.",
  "sources": [
    "public/app.js",
    "public/notifications.js",
    "test/notifications.test.js"
  ],
  "privacy_review": true,
  "status": "pending",
  "related_decisions": [],
  "related_commits": [],
  "follow_ups": [
    "Human-review the pending receipt before promoting it to canonical shared knowledge."
  ]
}
