{
  "schema_version": 1,
  "receipt_id": "2026-10-05-dashboard-calendar-feedback",
  "project_id": "teambrain",
  "actor_id": "codex",
  "created_at": "2026-10-05T23:45:00+03:00",
  "summary": "Updated the TeamBrain dashboard calendar to fit the desktop viewport, added selectable days and double-click date-prefilled event creation, added animated in-progress feedback to message, task, save, upload and refresh actions, and added a local favicon.",
  "sources": [
    "public/app.js",
    "public/notifications.css",
    "public/favicon.svg",
    "public/index.html",
    "src/dashboard-server.js",
    "test/workspace.test.js"
  ],
  "privacy_review": true,
  "status": "pending",
  "related_decisions": [],
  "related_commits": [],
  "follow_ups": [
    "Human-review the pending receipt before promoting it to canonical shared knowledge."
  ]
}
